..	For known or unknown reasons, your first choice shouldn't be second.
1.	As a statutory warning, stop stealing technologies from the animals.
2.	You should stick to either cosmos created from wave or bang promise.
3.	Total experience gained is equivalent to skipping names in totality.
4.	I have got one extra tooth so I know teeth are a communication port.
5.	The number of legs you have got is the number of lifelines you have.
6.	Smiling is typically allowed in the workspace if you are a consumer.
7.	No one would ever realise what the exact cause of this starting was.
8.	You open some businesses, counting grains of corn as a safety check.
9.	Mothers should find relief from conduct, ownership and/or languages.
10.	I can't be more proud of your overall literacy; those help building.
11.	Won't lie ever that I've powerful prosthetic organs, not just teeth.
12.	
13.	
14.	
15.	
16.	I never write paper books to answer you about my lifetime guarantee.
17.	Either read it herewith or share it in direct channels, i.e., async.
18.	Earth is the planet that resembles my expertise for vector graphics.
19.	A fixture is the first condition for the events which involve roads.
20.	Singing, painting, dancing, speaking and travelling are not primary.
21.	Add it to your ethic to bonus a third party with a secondary option.
22.	The easy work will be detecting a violation from a given standpoint.
23.	Ground practice, education is a diversion for mechanics, being busy.
24.	A perfect product would never carry any self-referencing attributes.
25.	Arrogance was actually switched to the variant, bypassing the posts.
26.	You must remember that; actually resourcefulness causes destruction.
::.	An inability to lose your ocean for your mountain rejects ethnicity.